{
  "claim_id": "d3d13c48-4dc3-4816-8d01-de3215878225",
  "claim_number": "D33B754ADA8F",
  "created_at": "2017-10-16T10:12:02.872Z",
  "updated_at": "2017-10-16T10:15:02.872Z",
  "policy_id": "8349345c-a6c5-4bf9-8ebb-6bbfc1628715",
  "policyholder_id": "00000000-0000-0000-0000-000000000004",
  "claim_status": "in_review",
  "approval_status": "repudiated",
  "currency": "ZAR",
  "claimant": {
    "email": "erlich@aviato.com",
    "first_name": "Erlich",
    "last_name": "Aviato",
    "relationship": "main_member"
  },
  "requested_amount": 13000000,
  "rejection_reason": "Claim is not covered under the terms and conditions of the policy.",
  "created_by": {
    "id": "00000000-0000-0000-0000-000000000001",
    "type": "user"
  }
}