{
  "claim_id": "d3d13c48-4dc3-4816-8d01-de3215878225",
  "created_at": "2017-10-16T10:12:02.872Z",
  "policy_id": "8349345c-a6c5-4bf9-8ebb-6bbfc1628715",
  "member_id": "673b8081-9668-4136-97cc-6ae0debda083",
  "covered_item_id": "9dc39b57-cdc7-48f9-a303-d7c4f0421a0c",
  "claim_status": "open",
  "approval_status": "pending",
  "app_data": {
    "key3": "value 3"
  },
  "requested_amount": 13000000,
  "created_by": {
    "id": "00000000-0000-0000-0000-000000000001",
    "type": "user"
  }
}