{
  "claim_id": "d3d13c48-4dc3-4816-8d01-de3215878225",
  "claim_number": "D33B754ADA8F",
  "created_at": "2017-10-16T10:12:02.872Z",
  "updated_at": "2017-10-16T10:15:02.872Z",
  "policy_id": "8349345c-a6c5-4bf9-8ebb-6bbfc1628715",
  "policyholder_id": "00000000-0000-0000-0000-000000000004",
  "member_id": "673b8081-9668-4136-97cc-6ae0debda083",
  "covered_item_id": "9dc39b57-cdc7-48f9-a303-d7c4f0421a0c",
  "claim_status": "open",
  "approval_status": "pending",
  "currency": "ZAR",
  "app_data": {
    "key1": "value 1",
    "key2": "value 2"
  },
  "claimant": {
    "first_name": "Erlich",
    "last_name": "Aviato",
    "email": "erlich@aviato.com"
  },
  "requested_amount": 13000000,
  "granted_amount": 9400000,
  "created_by": {
    "id": "00000000-0000-0000-0000-000000000001",
    "type": "user"
  }
}