[
  {
    "claim_id": "d3d13c48-4dc3-4816-8d01-de3215878225",
    "claim_number": "D33B754ADA8F",
    "created_at": "2017-10-16T10:12:02.872Z",
    "updated_at": "2017-10-16T10:15:02.872Z",
    "policy_id": "8349345c-a6c5-4bf9-8ebb-6bbfc1628715",
    "policyholder_id": "00000000-0000-0000-0000-000000000004",
    "member_id": "673b8081-9668-4136-97cc-6ae0debda083",
    "claim_status": "open",
    "approval_status": "pending",
    "claimant": {
      "first_name": "Erlich",
      "last_name": "Aviato",
      "email": "erlich@aviato.com"
    },
    "currency": "ZAR",
    "app_data": {
      "key1": "value 1"
    },
    "requested_amount": 13000000,
    "created_by": {
      "id": "00000000-0000-0000-0000-000000000001",
      "type": "user"
    }
  },
  {
    "claim_id": "cf5f074e-e09f-4d85-bc2d-07cfcae63f30",
    "claim_number": "CF5F074EDA8F",
    "created_at": "2017-10-14T11:09:55.332Z",
    "updated_at": "2017-10-14T12:00:00.000Z",
    "policy_id": "76096ff5-f4ed-47e2-8ac0-de16ba095508",
    "policyholder_id": "00000000-0000-0000-0000-000000000005",
    "covered_item_id": "9dc39b57-cdc7-48f9-a303-d7c4f0421a0c",
    "claim_status": "closed",
    "approval_status": "approved",
    "currency": "ZAR",
    "requested_amount": 2000000,
    "granted_amount": 1870000,
    "created_by": {
      "id": "00000000-0000-0000-0000-000000000001",
      "type": "user"
    }
  }
]